display_value,metric_name,identity,producer,contract_match_walkforward,sample_count,display_reproduction_status,evaluation_reproduction_status,reproducibility_status
32.81%,Current Model Accuracy,"prediction cohort/ledger accuracy = correct_predictions / evaluated_predictions using row-level y_true and y_pred; random holdout accuracy is advisory unless exact rows, seed, y_true/y_pred, and sample count are stored",prediction cohort / prediction ledger,False,0,SOURCE_MISSING,SOURCE_MISSING,SOURCE_MISSING
35.55/100,Overfit Risk,"100 * max(0, mean(train_accuracy) - mean(test_accuracy)); cannot reproduce without train/test fold metrics",walkforward.py:run_walkforward_validation,False,0,SOURCE_MISSING,UNVERIFIABLE,SOURCE_MISSING
45.68%,Walk-Forward Rolling Winrate,"unweighted mean of walk-forward test fold target profitable rate/trade winrate, not classifier accuracy, when winrate column exists",walkforward.py:_winrate/run_walkforward_validation,False,0,SOURCE_MISSING,UNVERIFIABLE,SOURCE_MISSING
64.38%,Walk-Forward Rolling Accuracy,unweighted mean of walkforward_results.csv test_accuracy folds according to producer code; weighted is audit-only when test_rows exists,walkforward.py:run_walkforward_validation,True,0,SOURCE_MISSING,UNVERIFIABLE,SOURCE_MISSING
65/100,AI Confidence,deterministic mean(predicted_probability) over evaluated prediction cohort/ledger rows; unavailable rather than invented when predicted_probability is absent,prediction cohort / prediction ledger,False,0,UNAVAILABLE,UNAVAILABLE,UNAVAILABLE
66.40%,Historical ML accuracy snapshot,requires ml_quality_audit artifact or DB evidence; not current readiness evidence until matching contract is proven,ml_quality_audit.py:run_audit,False,,SOURCE_MISSING,UNREPRODUCIBLE,SOURCE_MISSING
ROBUST,Model Health,rule-derived health from walk-forward stability and overfit risk; cannot reproduce without walk-forward source evidence,walkforward.py:_health,False,0,SOURCE_MISSING,UNVERIFIABLE,SOURCE_MISSING
~70%,Earlier historical snapshot,legacy/operator snapshot with no authoritative source discovered in repository fixtures,LEGACY_UNKNOWN,False,,SOURCE_MISSING,UNREPRODUCIBLE,SOURCE_MISSING
